<?xml version="1.0" encoding="UTF-8"?>
<!-- XML Sample Message of message hierarchy                                          -->
<!-- Message:             ADC AP Adjustments v1.0 Rev. 7                              -->
<!-- Transaction:         AA - Audit Data Collection Rev. 235                         -->
<!-- Datamodel:           Audit Data Collection Datamodel, version HEAD Rev. 312      -->
<!-- XML tagset used:     AdcsML                                                      -->
<!-- Generated at:        23-01-2021 17:45:20                                         -->
<!-- Generated using:     EC-Design 2.5.0 (http://www.ec-design.nl)                   -->
<!-- Generated by:        Jan Vrijenhoek (Digitect)                                   -->
<!-- Organisation:        Digitect B.V. (Digitect)                                    -->
<!-- NOTE:    This sample message was generated automatically: manual modifications will be lost -->
<AdcApAdjustments xsi:schemaLocation="http://schemas.iso.org/AdcsML/Messages/AdcApAdjustments-v1 AdcApAdjustments-v1.0.xsd"
		xmlns="http://schemas.iso.org/AdcsML/Messages/AdcApAdjustments-v1"
		xmlns:xsi="http://www.w3.org/2001/XMLSchema-instance">
	<ApAdj>
		<AdjId>AD1234</AdjId>
		<AdjNr>123456789</AdjNr>
		<AdjTypNm>Finance charge.</AdjTypNm>
		<AdjDocNr>123456789</AdjDocNr>
		<InvoiId>I001</InvoiId>
		<JrnId>JRN1</JrnId>
		<FiscYr>2020</FiscYr>
		<AcntingPer>M1</AcntingPer>
		<AdjDt>2020-02-01</AdjDt>
		<SuplAcntId>S00001</SuplAcntId>
		<GlDbAcntNr>ACC123456789</GlDbAcntNr>
		<GlCrAcntNr>ACC123456789</GlCrAcntNr>
		<BusSgX>BS001</BusSgX>
		<AdjdAmt>
			<FuncAmt>125.1255</FuncAmt>
			<FuncCurCd>USD</FuncCurCd>
			<TrAmt>125.1255</TrAmt>
			<TrCurCd>USD</TrCurCd>
			<RprtAmt>125.1255</RprtAmt>
			<RprtCurCd>USD</RprtCurCd>
			<LocAmt>125.1255</LocAmt>
			<LocCurCd>USD</LocCurCd>
		</AdjdAmt>
		<Tax>
			<TaxTypCd>TAX01</TaxTypCd>
			<TaxLocAmt>2000.0000</TaxLocAmt>
			<GlTaxDbAcntNr>ACC123456789</GlTaxDbAcntNr>
			<GlTaxCrAcntNr>ACC123456789</GlTaxCrAcntNr>
		</Tax>
		<Crea>
			<UserId>JD</UserId>
			<Dt>2020-03-02</Dt>
			<Tm>09:31</Tm>
		</Crea>
		<Aprv>
			<UserId>JD</UserId>
			<Dt>2020-03-02</Dt>
			<Tm>09:31</Tm>
		</Aprv>
		<LstMdf>
			<UserId>JD</UserId>
			<Dt>2020-03-02</Dt>
			<Tm>09:31</Tm>
		</LstMdf>
	</ApAdj>
</AdcApAdjustments>
